{"schemaVersion":"avp/1.0","verified":true,"chainId":8453,"blockNumber":48511342,"blockHash":"0x4c071dc0039f0f21a2dc7f04acdea87e64ae2f1555f4d6f411cb3802362a9770","txHash":"0x3506034b7b638f4f420a9bd47f9d4a6ca6a93dbeef1a2e43bcea5a2aa891461f","txIndex":168,"consensus":{"sources":11,"responders":11,"agreed":11,"quorum":9,"agreedSources":["1rpc.io","api.zan.top","base-mainnet.public.blastapi.io","base-pokt.nodies.app","base-rpc.publicnode.com","base.drpc.org","base.gateway.tenderly.co","base.lava.build","base.rpc.blxrbdn.com","blockscout","mainnet.base.org"]},"finality":{"finalized":true,"finalizedBlock":48514342,"confirmations":3501},"merkleProof":{"type":"transactionsTrie","transactionsRoot":"0xd66ad64f30bc3197e9e8625dc79e7a770432a82995c521ea66475aecc2984408","txIndex":168,"key":"0x81a8","nodes":["0xf90131a0940a474ad1267c2067ca9c70d296c06880c604569b6a7a204414623ff754403ba0da04ea37df9eb408f1537dc64a796d89c013700e8d835de99e7aa0947cbe3501a0154af54c59e3e513bfbd1ac103aff9b88307c9e9c1ac622514ee711973de30e9a0f0a70762921f693f6f692a149ca4dabb0bc7eabf3d9d4fd6e72127cf4ff1e89ea0eb713675e45645d9a6ba233d9d0f03c66477faa4d1b084cbc05fba412c2b7f23a00546cc559f0fef56a73140fae6c54c90b27523b1afd77ed9a62d967598ba05b3a0a430c2e116337a5b649ced6b53d4272ef7bee1406aa99cf6ee13579fb13dbd72a015a2b940b79c22e5ef9db0bac05d7ffc4cb6722333eb02959a5e945268637b5ea01051ff060afdccc4aec884269e98ae060d08fc52d0318d91ef64f0fe35d1da6d8080808080808080","0xf871a0bf7ff26c6e07cbd81ce5168bce6a97bedea1b3d6bec4bb644319533313f77973a0147944dc42aec76904c428a095768fe9cec03b3a46807c0726a6e295c09bd6e0a07906d60fb75cdba608a5e5a05e8cdd1bcc18b8192809794ef5d6a37be25639e78080808080808080808080808080","0xf901118080808080808080a026075cc97220189b9a913de160ac72decf5487d741b0571c321976eed15d964fa06e20525b0c85fc4cc30ff0d634d223f0a6a3986e51f1a988703b11c51016d295a0bf4979dd7a89e3bf60c59557769172238933430eaa181fb531aed13fa6dc75dda064ad06755587716e9d079e862af07335de9fa7dd5241f82ad5fdac862d7b19c4a00c9eb6e4c119bd9ffa13335055f46a301db444e0d10e3d65bc26f19697a81b4aa0b65e97c705227ad5a42c90401a641623f207c08e6dd077a4312551d1f30dc116a0b4013a37142cbc85c2caa1c7f3564af816d4daa07213d23b0294e4c0fc9b76f9a02953e8e81bcefb5fa3fd3089379d50adccf4161d484fc0db67f8bb7719911d8080","0xf90211a07f183e4438d054033d0efdbe2dc5a31c15b8dbe294c581ba4c34823a3de592d2a05aa7247255c7cef04b213e528841ccc94257f5c7c2816997693447888af207f9a05391cd53a21b255d092689f6729d843ef7295cf45cc95918390ed8e509bb00f1a0f7d58583a739d88693f9f3f9ff8d4af931ce0a630f9fb3a56f125cdaeb6fcf58a0072102277881bc81bf8bc78ebab2f400206591e46bfcc594cd24ddec44a076d7a0a966b6a8b92a3cae5ab96c434be704444c07ecafaff0d1ab12b72e9ee6575458a0292ce5bffc0ef77896678134cac5f25b6fabb8fa1499a39524ff95e6ad598811a087bed61fc5872081466f03a5f8b3b7bd550ae8708df3e7d470651a5449973479a02aedaa092de780492befec15f870a728d5ebc40477dc620515ba113d22982133a003f3a3d12c3b487466e699ce83a4641c9f14244f74c3f31ced43ad23c7560cfea0f8c97ef9302a98e7032caf1e348fd0db5dc396141f13de1a28fbd62572cbbb61a0256c2a8616783f6a0b0314e3594b3c87c2e5c7bc78ec776b349041778b5beaeca0cc726ea44d30b9a45d3ca6be138623a9a9c1670d5daaa31e27969596f5f5bc42a04088850bf2b269ce4954d4ea6250097c0624b843b344c3132c2e1fbfd9160991a064c292a73cbf0f40ce6eca06977d74385eed7076e22ab2615ad06919851ad6c2a0b569d2652eabb931e010b23b852dd7a9857375179f01141d8c50680bf71a119a80","0xf8d920b8d602f8d382210583093122830f424083a7d8c08307a12094720550baf29d5d0f45f49c12d0526202fc28845480b864c195a17b0000000000000000000000000000000000000000000000000000000000000020000000000000000000000000000000000000000000000000000000000000001100000000001368d800fbac0f70eac05c7a000000000000000000000000000000c001a06f364022ce48f012a3c2842744d81604c91e3f2a152f23c0311d76a6c663e7a1a04b8dff7120a54e20ed2b5f30e666a2c7ce0bd82ba53d236d85a294610887b986"],"leaf":"0x02f8d382210583093122830f424083a7d8c08307a12094720550baf29d5d0f45f49c12d0526202fc28845480b864c195a17b0000000000000000000000000000000000000000000000000000000000000020000000000000000000000000000000000000000000000000000000000000001100000000001368d800fbac0f70eac05c7a000000000000000000000000000000c001a06f364022ce48f012a3c2842744d81604c91e3f2a152f23c0311d76a6c663e7a1a04b8dff7120a54e20ed2b5f30e666a2c7ce0bd82ba53d236d85a294610887b986"},"attestation":{"signer":"0xcf67379569e5C023199DDB14E71037675Be34247","scheme":"EIP-191","signature":"0x016c61e5cfd830d01771fc49e061622ff6869c79c813929930889821a10bd9d945c92d76fca1b46f7128d6ccd417c35ee23b9cb4b2fca08defc5408040990a651c"},"bond":null,"reason":null,"issuedAt":1783819036}
