{"schemaVersion":"avp/1.0","verified":true,"chainId":8453,"blockNumber":48499416,"blockHash":"0xbfd92c607e205cccaa847b31bb0a77b3ab70524bb641d7cf752f5ba17e1005dc","txHash":"0xc06bfed4be4c87b40781f28d0a90b4e8778f926175610b664b7f6e2c6c747ef3","txIndex":82,"consensus":{"sources":11,"responders":11,"agreed":10,"quorum":9,"agreedSources":["1rpc.io","api.zan.top","base-mainnet.public.blastapi.io","base-pokt.nodies.app","base.drpc.org","base.gateway.tenderly.co","base.lava.build","base.rpc.blxrbdn.com","blockscout","mainnet.base.org"]},"finality":{"finalized":true,"finalizedBlock":48513567,"confirmations":14750},"merkleProof":null,"attestation":{"signer":"0xcf67379569e5C023199DDB14E71037675Be34247","scheme":"EIP-191","signature":"0x2bf18087433843a137cfa15c2e2f854f35951a1a5dd1df6fbfbda4b485b53f9c0287dbab1cb9e9f69c992ee66c6813eeae6d5b51d9bc65957d06152a514c0ce81c"},"bond":{"contract":"0x69D095fb49bcE5735d48710Eb8dD6F94aD72fF85","stakedUSDC":"0.50","challengeWindowSec":3600,"proofId":"0xf068444df47e962b4b19039a68ac9dab414392b562bc2b9b889282d3268f09b0","anchored":false,"anchorTx":null},"reason":null,"issuedAt":1783817681}
